id,label,text,prediction_old,prediction_new,prediction_changed,n_models_error,models_with_error,reasoning
1,ham,"Go until jurong point, crazy.. Available only in bugis n great world la e buffet... Cine there got amore wat...",spam,ham,True,3,"['gpt-3.5-turbo-0125', 'gpt-5-nano', 'gpt-4o-mini']","1. Linguistic cues: Informal, colloquial language and local slang (""la"", ""wat"", ""n"", ""e"") and place names (""jurong point"", ""bugis"", ""great world"") indicate a casual conversational tone rather than a sales pitch.
2. Structural cues: Ellipses and fragmented sentences mimic spoken chat; no phone numbers, links, offers, or marketing phrasing present.
3. Contextual interpretation: The message appears to discuss locations and options (buffet, cinema) — likely arranging or commenting about plans — which is personal/relational in intent.
4. Decision summary: The tone, wording, and context point to an informal personal message, not unsolicited promotion, so it is ham."
8,ham,As per your request 'Melle Melle (Oru Minnaminunginte Nurungu Vettam)' has been set as your callertune for all Callers. Press *9 to copy your friends Callertune,spam,ham,True,3,"['gpt-4.1-mini', 'gpt-5-nano', 'gpt-4o-mini']","1. Linguistic cues: Phrases like ""As per your request"" and ""has been set as your callertune"" indicate a confirmation of a user-initiated service change rather than an unsolicited offer. The message quotes a specific song title, which is informational.
2. Structural cues: The message is a short, formal service notification without promotional language, links, or requests for personal/financial information. It includes a simple action code (""Press *9"") typical of telecom service messages.
3. Contextual interpretation: The intent is to confirm that a callertune was set and to provide an optional action to copy a friend's callertune — a transactional/utility notification from a service provider rather than spam or a scam.
4. Decision summary: The content is a legitimate service confirmation and actionable instruction related to the user's request, so it is classified as ham."
55,spam,SMS. ac Sptv: The New Jersey Devils and the Detroit Red Wings play Ice Hockey. Correct or Incorrect? End? Reply END SPTV,ham,ham,False,3,"['gpt-4.1-mini', 'gpt-5-nano', 'gpt-5-mini']","1. Linguistic cues: The message names sports teams and asks a factual question (""Correct or Incorrect?""), with no promotional language (no offers, prices, links, or calls to buy).
2. Structural cues: Short SMS-style phrasing and an instruction to ""Reply END SPTV"" indicates an interactive quiz/confirmation format rather than marketing copy; punctuation and capitalization are neutral.
3. Contextual interpretation: The purpose appears to be a quick sports trivia/confirmation prompt from a service, not an unsolicited advertisement or fraud attempt.
4. Decision summary: Because the text is informational/interactive about sports and lacks promotional or malicious intent, it is classified as ham."
67,ham,"Today is ""song dedicated day.."" Which song will u dedicate for me? Send this to all ur valuable frnds but first rply me...",spam,spam,False,3,"['gpt-3.5-turbo-0125', 'gpt-5-nano', 'gpt-4o-mini']","1. Linguistic cues: Use of imperative forwarding language (""Send this to all ur valuable frnds""), casual shorthand (""u"", ""ur"", ""frnds""), and chain-like phrasing (""Today is 'song dedicated day..'"").
2. Structural cues: Ellipses and informal punctuation create a viral/chain-message tone; explicit call-to-action to forward the message.
3. Contextual interpretation: The message is designed to propagate itself to many recipients (a chain/forward request), not to convey personal or informational content — typical of unsolicited or viral spam.
4. Decision summary: Although not promotional or fraudulent, the primary intent is mass forwarding and propagation, classifying it as spam."
268,ham,"Come to mu, we're sorting out our narcotics situation",spam,ham,True,3,"['gpt-3.5-turbo-0125', 'gpt-5-nano', 'gpt-4o-mini']","1. Linguistic cues: <Informal, conversational phrasing (""Come to mu,"" ""we're sorting out""), direct invitation; contains the word ""narcotics"" indicating discussion of drugs but no promotional language.>
2. Structural cues: <Short, single-message format with contractions, no links, offers, prices, or marketing phrasing; looks like a personal text.>
3. Contextual interpretation: <Reads as a private, person-to-person invite to address an issue involving drugs rather than an unsolicited commercial or promotional message.>
4. Decision summary: <Despite referencing illegal activity, the message is a personal invitation and not promotional or fraudulent, so it fits the ""ham"" category.>"
404,ham,Message:some text missing* Sender:Name Missing* *Number Missing *Sent:Date missing *Missing U a lot thats y everything is missing sent via fullonsms.com,spam,ham,True,3,"['gpt-3.5-turbo-0125', 'gpt-5-nano', 'gpt-4o-mini']","1. Linguistic cues: Phrases like ""Missing U a lot thats y everything is missing"" express personal sentiment and direct address, typical of a personal message rather than an advertisement or scam.
2. Structural cues: The text contains placeholders and metadata (""some text missing"", ""Sender:Name Missing""), and lacks promotional wording, calls to action, prices, or urgent directives commonly found in spam.
3. Contextual interpretation: Although it mentions ""sent via fullonsms.com"" (a third‑party SMS service), the core intent appears emotional/personal rather than commercial or fraudulent.
4. Decision summary: Overall content and tone indicate a personal message conveying emotion, so it should be classified as ham."
832,ham,"I am real, baby! I want to bring out your inner tigress...",spam,spam,False,3,"['gpt-3.5-turbo-0125', 'gpt-4o-mini', 'gpt-4.1']","1. Linguistic cues: Uses highly suggestive, seductive language (""baby"", ""bring out your inner tigress"") typical of solicitation rather than neutral personal content.
2. Structural cues: Short, punchy sentence with an ellipsis and exclamation — common in attention-grabbing promotional or spammy messages designed to entice.
3. Contextual interpretation: The message reads like an unsolicited sexual proposition (possible adult chat or dating solicitation) rather than a benign personal update or genuine conversational message.
4. Decision summary: The combination of erotic phrasing, persuasive tone, and lacking personal context indicates an unsolicited/solicitous intent, so it is classified as spam."
907,ham,K:)i will give my kvb acc details:),spam,ham,True,3,"['gpt-4.1-mini', 'gpt-3.5-turbo-0125', 'gpt-4o-mini']","1. Linguistic cues: First-person phrasing (""i will give my kvb acc details"") and friendly emoticons ("":)"") indicate a personal, casual message rather than marketing language.
2. Structural cues: Informal, short sentence with no promotional keywords, no links, no phone numbers, no offers, and no urgent call-to-action typical of spam.
3. Contextual interpretation: The sender is offering to share personal bank account details (private, transactional/one-to-one communication), which implies a legitimate personal exchange rather than unsolicited advertising or fraud.
4. Decision summary: The content, tone, and structure point to a personal message about sharing private information, so it should be classified as ham."
951,ham,what is your account number?,spam,ham,True,3,"['gpt-5-nano', 'gpt-5', 'gpt-4o-mini']","1. Linguistic cues: The message is a simple, direct question (""what is your account number?"") using conversational language and no promotional wording.
2. Structural cues: Short, lowercase sentence with no links, offers, calls to action, or typical spam punctuation (e.g., excessive symbols or urgent caps).
3. Contextual interpretation: It appears to be a personal/requesting question seeking information rather than trying to sell, advertise, or defraud; there are no clear indicators of unsolicited commercial content.
4. Decision summary: Because the content is a straightforward, non-promotional question without spammy markers, it is classified as ham."
956,ham,Hey you can pay. With salary de. Only <#> .,spam,ham,True,3,"['gpt-3.5-turbo-0125', 'gpt-5-nano', 'gpt-4o-mini']","1. Linguistic cues: Informal, conversational language (""Hey you can pay"", ""With salary de"") suggests a personal message rather than marketing copy; no promotional words like ""free"", ""win"", ""offer"", ""buy now"".
2. Structural cues: Short, fragmented sentences and a direct address (""Hey you"") look like a one-to-one request; presence of an amount placeholder (""<#>"") implies a specific personal sum rather than a generic deal.
3. Contextual interpretation: The message appears to be asking or reminding a recipient to make a payment, likely between acquaintances (mention of salary implies personal repayment timing), not soliciting a broad audience.
4. Decision summary: The content reads as a personal payment request/reminder with informal phrasing and no promotional intent, so it is classified as ham."
1196,ham,I want to send something that can sell fast. <#> k is not easy money.,spam,ham,True,3,"['gpt-3.5-turbo-0125', 'gpt-5-nano', 'gpt-4o-mini']","1. Linguistic cues: First-person phrasing (""I want to send something"", ""is not easy money"") indicates a personal statement rather than a promotional pitch; no marketing buzzwords like ""free"", ""win"", ""offer"", or urgent calls-to-action.
2. Structural cues: Simple sentence structure, informal tone, and use of a placeholder (""<#> k"") suggesting a personal reference to an amount rather than a formatted promotional offer or URL.
3. Contextual interpretation: The message reads as someone discussing selling an item quickly and remarking that a certain amount (""<#>k"") is not easy money — this expresses intent or opinion rather than soliciting or advertising to the recipient.
4. Decision summary: Overall content and tone are personal and informational, not promotional or unsolicited, so the appropriate label is ham."
1408,ham,"That's good, because I need drugs",spam,ham,True,3,"['gpt-3.5-turbo-0125', 'gpt-5-nano', 'gpt-4o-mini']","1. Linguistic cues: Uses first-person phrasing (""I need drugs"") and casual conversational tone (""That's good, because ...""), indicating a personal statement rather than promotional language.
2. Structural cues: Short, single-sentence message with no marketing markers (no links, prices, offers, call-to-action, or branded language).
3. Contextual interpretation: The message expresses an individual's need (potentially medical or personal) rather than attempting to sell, advertise, or scam; intent appears personal/communicative.
4. Decision summary: Despite referencing ""drugs,"" the message lacks promotional or unsolicited characteristics and functions as a personal statement, so it should be classified as ham."
1535,ham,There are no other charges after transfer charges and you can withdraw anyhow you like,spam,ham,True,3,"['gpt-5-nano', 'gpt-5-mini', 'gpt-4o-mini']","1. Linguistic cues: Uses neutral, informational language (""no other charges"", ""you can withdraw anyhow you like"") rather than promotional or persuasive wording.
2. Structural cues: Single plain sentence with no links, phone numbers, call-to-action, or marketing phrases; no urgency or sales punctuation.
3. Contextual interpretation: Reads like a transactional or personal clarification about fees and withdrawal options (likely from a bank or a person), not an unsolicited offer or scam.
4. Decision summary: The message is informational and non-promotional, so it is classified as ham."
1663,ham,"As in missionary hook up, doggy hook up, standing...|",spam,ham,True,3,"['gpt-4.1-mini', 'gpt-3.5-turbo-0125', 'gpt-4o-mini']","1. Linguistic cues: The message contains explicit sexual terms (""missionary,"" ""doggy,"" ""hook up,"" ""standing"") that indicate a personal sexual context rather than commercial language or offers.
2. Structural cues: Short, casual phrasing and trailing ellipsis suggest conversational or flirtatious text rather than a structured advertisement, link, or call-to-action typical of spam.
3. Contextual interpretation: The content appears to be part of a personal/sexual discussion or sexting about positions and hookup activity, not an unsolicited promotional, fraudulent, or marketing message.
4. Decision summary: Because the message is explicit and personal in nature without promotional intent or spam-like formatting, it should be classified as ham."
1787,ham,You got job in wipro:)you will get every thing in life in 2 or 3 years.,spam,ham,True,3,"['gpt-3.5-turbo-0125', 'gpt-5-nano', 'gpt-4o-mini']","1. Linguistic cues: Congratulatory phrasing (""You got job in wipro"", ""you will get every thing in life""), use of a smiley emoticon "":)"" and second-person address indicate a personal, supportive tone.
2. Structural cues: Casual punctuation and informal spacing, no links, offers, phone numbers, or marketing language present.
3. Contextual interpretation: The message shares personal news and encouragement rather than promoting a product, service, or scam; it reads like a friend or acquaintance celebrating good news.
4. Decision summary: All cues point to a legitimate, non-promotional personal message, so the correct label is ham."
1991,ham,Who's there say hi to our drugdealer,spam,ham,True,3,"['gpt-3.5-turbo-0125', 'gpt-5-nano', 'gpt-4o-mini']","1. Linguistic cues: Informal, conversational language (""Who's there"", ""say hi"", ""our drugdealer"") suggests a personal message between acquaintances rather than promotional copy.
2. Structural cues: No links, phone numbers, offers, or call-to-action typical of spam; casual punctuation and phrasing indicate a direct chat-style text.
3. Contextual interpretation: The intent appears to be social—asking someone to identify themselves or greet a known person—rather than advertising, soliciting, or scamming.
4. Decision summary: Despite referencing an illicit role, the message reads as a personal, informal prompt to greet someone, so it is classified as ham."
2117,ham,soon you will have the real thing princess! Do i make you wet? :),spam,ham,True,3,"['gpt-3.5-turbo-0125', 'gpt-5-mini', 'gpt-4o-mini']","1. Linguistic cues: Contains direct, intimate language and sexual phrasing (""princess"", ""Do i make you wet?"") and a smiling emoticon, indicating a personal, flirtatious tone rather than promotional wording.
2. Structural cues: Informal capitalization and punctuation, use of a pet name and emoticon, and no links, offers, or call-to-action typical of spam.
3. Contextual interpretation: Message appears intended to arouse or flirt with a specific recipient (personal communication) rather than to advertise, solicit, or deceive.
4. Decision summary: The intimate, conversational language and lack of promotional content indicate this is a personal/sexual message, so it is classified as ham."
2169,ham,Here got lots of hair dresser fr china.,spam,ham,True,3,"['gpt-4.1-mini', 'gpt-5-nano', 'gpt-4o-mini']","1. Linguistic cues: Colloquial phrasing (""Here got lots of...,"" ""fr"" for ""from"") and informal tone indicate a casual, conversational message rather than marketing copy.
2. Structural cues: Short, single-sentence statement with no call-to-action, price, link, or typical promotional wording.
3. Contextual interpretation: Reads like an observation or message to a friend about the local availability of hairdressers from China, not an unsolicited commercial offer.
4. Decision summary: The informal language and lack of promotional markers point to a personal remark, so the message is classified as ham."
2269,ham,"A Boy loved a gal. He propsd bt she didnt mind. He gv lv lttrs, Bt her frnds threw thm. Again d boy decided 2 aproach d gal , dt time a truck was speeding towards d gal. Wn it was about 2 hit d girl,d boy ran like hell n saved her. She asked 'hw cn u run so fast?' D boy replied ""Boost is d secret of my energy"" n instantly d girl shouted ""our energy"" n Thy lived happily 2gthr drinking boost evrydy Moral of d story:- I hv free msgs:D;): gud ni8",spam,spam,False,3,"['gpt-3.5-turbo-0125', 'gpt-5-nano', 'gpt-4o-mini']","1. Linguistic cues: Mentions a commercial product by name (""Boost"", ""drinking boost evrydy"", ""Boost is d secret of my energy"") and includes an explicit offer-like phrase (""I hv free msgs""), which are common in promotional or forwarded marketing texts.
2. Structural cues: Heavy use of leetspeak/abbreviations, emoticons, and a short anecdotal story ending with a moral — a format typical of chain/forwarded promotional SMS rather than a personal message.
3. Contextual interpretation: The story serves to endorse the product (portrays Boost as the source of energy and happiness), indicating promotional intent rather than a purely personal communication.
4. Decision summary: Because the message promotes a branded product and resembles a chain/marketing forward with an offer of ""free msgs,"" it should be classified as spam."
2283,ham,Your pussy is perfect!,spam,ham,True,3,"['gpt-3.5-turbo-0125', 'gpt-5-mini', 'gpt-4o-mini']","1. Linguistic cues: The message uses direct, explicit sexual language (""pussy"") and a personal second‑person address (""Your""), framed as a compliment (""is perfect!""), indicating an intimate or personal tone rather than promotional phrasing.
2. Structural cues: It's a short, single declarative sentence with exclamatory emphasis; there are no links, numbers, offers, or calls to action typical of spam/phishing.
3. Contextual interpretation: The content reads as a personal erotic compliment likely intended for an individual recipient rather than an unsolicited commercial or fraudulent solicitation.
4. Decision summary: Because the message is intimate/personal in tone, lacks promotional or deceptive elements, and appears to be a direct sexual remark rather than an advertisement or scam, it is best classified as ham."
2530,ham,"Hi, can i please get a <#> dollar loan from you. I.ll pay you back by mid february. Pls.",spam,ham,True,3,"['gpt-3.5-turbo-0125', 'gpt-5-nano', 'gpt-4o-mini']","1. Linguistic cues: Polite, first-person plea (""Hi, can i please get..."", ""I.ll pay you back"", ""Pls."") with personal timeframe (""by mid february"")—language of a personal request rather than a promotional pitch.
2. Structural cues: Informal punctuation/typos (I.ll), no links, no business names, offers, discounts, or call-to-action typical of spam.
3. Contextual interpretation: The message is asking an individual for a personal loan and promising repayment—an interpersonal financial request, not unsolicited advertising or a fraudulent-sounding mass message.
4. Decision summary: The content and style indicate a personal plea for help rather than commercial or promotional messaging, so it should be labeled ham."
2543,spam,"Hello darling how are you today? I would love to have a chat, why dont you tell me what you look like and what you are in to sexy?",ham,spam,True,3,"['gpt-4.1-mini', 'gpt-5-nano', 'gpt-5']","1. Linguistic cues: Use of terms like ""darling"" and ""sexy"" and the request ""tell me what you look like and what you are in to"" signal sexual solicitation and flirtatious intent.
2. Structural cues: Informal, one-shot opening with casual punctuation and a conversational push to engage (no personal context or reference), typical of unsolicited messages.
3. Contextual interpretation: The message's purpose is to initiate an explicit/personal chat and solicit personal descriptors — characteristic of unwanted adult solicitation or spam rather than a routine personal message.
4. Decision summary: Language and tone indicate an unsolicited sexual approach intended to provoke a response, so the message is classified as spam."
2593,ham,Cool. I am <#> inches long. hope you like them big!,spam,ham,True,3,"['gpt-3.5-turbo-0125', 'gpt-4o-mini', 'gpt-4.1']","1. Linguistic cues: The message uses explicit, sexual language (""I am <#> inches long"", ""hope you like them big!"") and informal, conversational tone (""Cool."").
2. Structural cues: Short, direct sentences without URLs, offers, calls to action, or commercial phrasing; contains a redacted numeric placeholder (""<#>"") suggesting a personal attribute rather than promotional content.
3. Contextual interpretation: The intent appears to be personal/sexual communication or flirtation directed at the recipient, not an unsolicited advertisement, scam, or promotional message.
4. Decision summary: Although explicit, the message is personal and non-commercial in nature, so it should be classified as ham."
2634,ham,"Open rebtel with firefox. When it loads just put plus sign in the user name place, and it will show you two numbers. The lower number is my number. Once you pick that number the pin will display okay!",spam,ham,True,3,"['gpt-3.5-turbo-0125', 'gpt-5-nano', 'gpt-4o-mini']","1. Linguistic cues: Uses direct, instructional language (""Open rebtel with firefox"", ""put plus sign"", ""Once you pick that number the pin will display""), mentions ""my number"" which indicates a personal context rather than promotion.
2. Structural cues: Plain, conversational sentence structure with step-by-step directions, no marketing phrases, no links, no call-to-action typical of spam.
3. Contextual interpretation: The message appears to be troubleshooting or guiding someone to retrieve a PIN/phone number on a specific service (Rebtel) — a personal or support-oriented intent rather than unsolicited advertising or fraud.
4. Decision summary: Because it provides specific, personal instructions without promotional or fraudulent indicators, it is classified as ham."
2655,ham,Yeah get the unlimited,spam,ham,True,3,"['gpt-3.5-turbo-0125', 'gpt-5-nano', 'gpt-4o-mini']","1. Linguistic cues: Informal, conversational wording (""Yeah get the unlimited"") with casual affirmation ""Yeah"" and directive ""get"" suggests a personal reply or recommendation rather than a promotional pitch.
2. Structural cues: Short, plain text with no marketing markers (no brand names, no links, no capitalization patterns, no phone numbers or codes) and no sales-y phrasing like ""buy now,"" ""free,"" or ""limited time.""
3. Contextual interpretation: Reads like a one-to-one response advising someone to choose an ""unlimited"" option (e.g., a phone plan or service) in a personal conversation, not an unsolicited advertisement or scam.
4. Decision summary: The message is an informal, personal recommendation without promotional or fraudulent indicators, so it is labeled ham."
3040,ham,What's ur pin?,spam,ham,True,3,"['gpt-3.5-turbo-0125', 'gpt-5-nano', 'gpt-4o-mini']","1. Linguistic cues: Informal, conversational language (""What's ur"" using text shorthand ""ur"") and a direct question; no marketing words (free, win, offer) or calls-to-action typical of spam.
2. Structural cues: Very short, single-sentence question with a question mark; lacks links, numbers, promotional formatting, or bulk-mail markers.
3. Contextual interpretation: The message appears to be a person asking another person for a PIN (personal/transactional information) rather than an unsolicited promotional or fraudulent pitch. While requesting a PIN can be risky, the intent expressed is interpersonal rather than promotional.
4. Decision summary: The style and content indicate a private, conversational request, so it is classified as ham (non-promotional)."
3226,spam,LIFE has never been this much fun and great until you came in. You made it truly special for me. I won't forget you! enjoy @ one gbp/sms,ham,spam,True,3,"['gpt-3.5-turbo-0125', 'gpt-5-nano', 'gpt-5-mini']","1. Linguistic cues: The affectionate language (""LIFE has never been this much fun...You made it truly special"") mimics a personal message, but the closing phrase ""enjoy @ one gbp/sms"" explicitly mentions a price and per-SMS rate, which is a commercial/payment cue.
2. Structural cues: Use of ""@"" and the pricing unit ""one gbp/sms"" (currency + ""/sms"") is typical of promotional or premium service messages rather than genuine personal texts.
3. Contextual interpretation: The presence of a cost implies the sender intends to monetize the message (subscription or premium SMS), making it promotional/unsolicited rather than purely personal.
4. Decision summary: Despite the sentimental wording, the explicit pricing and service-style format indicate a commercial/premium message, so it should be classified as spam."
3229,spam,Welcome! Please reply with your AGE and GENDER to begin. e.g 24M,ham,spam,True,3,"['gpt-5', 'gpt-5-mini', 'gpt-4.1']","1. Linguistic cues: Uses an imperative prompt (""Please reply with your AGE and GENDER"") and a terse example (""e.g 24M""), which are common in automated, non-personal messages.
2. Structural cues: Template-like, generic greeting (""Welcome!""), all-caps labels (AGE and GENDER), and a short, transactional format indicate an automated/system message rather than a personal conversation.
3. Contextual interpretation: The message is soliciting personal demographic information likely for registration, marketing, or data collection — typical behavior of promotional or unsolicited services rather than a personal/human sender.
4. Decision summary: The combination of automated tone, template structure, and solicitation of personal info indicates this is spam."
