id,label,text,prediction_old,prediction_new,prediction_changed,n_models_error,models_with_error,reasoning
3326,ham,Should i send you naughty pix? :),spam,ham,True,3,"['gpt-3.5-turbo-0125', 'gpt-5-mini', 'gpt-4o-mini']","1. Linguistic cues: Informal, conversational language (""naughty pix"", smiley "":)""), first-person question directly addressing the recipient — indicates a personal solicitation rather than a commercial offer.
2. Structural cues: Short, single-sentence question with casual punctuation and a smiley emoticon; lacks links, offers, or marketing language typical of spam.
3. Contextual interpretation: The intent is to solicit sexual images from the recipient in a personal exchange; there is no promotion, product, or fraudulent scheme.
4. Decision summary: Although explicit and potentially inappropriate, the message is a personal solicitation rather than unsolicited commercial or fraudulent content, so it is classified as ham."
3473,ham,Great! I shoot big loads so get ready!,spam,ham,True,3,"['gpt-3.5-turbo-0125', 'gpt-4o-mini', 'gpt-4.1']","1. Linguistic cues: The message uses informal, first-person language and explicit sexual phrasing (""I shoot big loads"", ""get ready!"") indicating a personal, intimate tone rather than commercial or promotional wording.
2. Structural cues: Short, direct sentences with exclamation marks and no links, offers, or call-to-action typical of ads or scams.
3. Contextual interpretation: The content appears to be a personal sexual message directed at a known recipient rather than unsolicited solicitation, fraud, or marketing.
4. Decision summary: Given the explicit, personal nature and absence of promotional or deceptive elements, this is best classified as ham (personal/legitimate) rather than spam."
3521,spam,2/2 146tf150p,ham,ham,False,3,"['gpt-5-nano', 'gpt-5-mini', 'gpt-4.1']","1. Linguistic cues: The message contains only terse alphanumeric tokens (""2/2 146tf150p"") with no promotional keywords (e.g., ""free"", ""win"", ""offer"", ""buy""), no URLs, and no call-to-action language.
2. Structural cues: The short, compact format resembles a personal shorthand or code (dates, measurements, or notes) rather than the longer, formatted structure typical of spam (sales pitch, pricing, links, instructions to reply).
3. Contextual interpretation: The content appears to be a brief personal note or coded information (e.g., a date and numeric/alpha code) with no persuasive or unsolicited intent; there is no indication of advertising, phishing, or fraud.
4. Decision summary: Absence of promotional language, links, or solicitations and the presence of terse, likely personal shorthand lead to classification as ham."
3603,ham,Let's pool our money together and buy a bunch of lotto tickets. If we win I get <#> % u get <#> %. Deal?,spam,ham,True,3,"['gpt-3.5-turbo-0125', 'gpt-5-nano', 'gpt-4o-mini']","1. Linguistic cues: Informal language and shorthand (""Let's"", ""u"", ""Deal?"") and first-person/plural pronouns (""our"", ""we"") indicate a personal one-to-one proposal rather than a commercial pitch.
2. Structural cues: Casual punctuation and sentence structure, no links, no call-to-action typical of marketing, and use of placeholders (""<#> %"") rather than promotional details.
3. Contextual interpretation: The message proposes splitting lottery tickets and winnings among participants — a personal solicitation to collaborate, not an unsolicited advertisement, scam, or mass promotion.
4. Decision summary: The content is a personal invitation to pool money for lotto tickets, lacking promotional or fraudulent markers, so it should be classified as ham."
3607,ham,Early bird! Any purchases yet?,spam,ham,True,3,"['gpt-3.5-turbo-0125', 'gpt-5-nano', 'gpt-4o-mini']","1. Linguistic cues: Casual, conversational language (""Early bird!"", ""Any purchases yet?"") with no promotional wording, offers, links, or calls to action typical of spam.
2. Structural cues: Short, informal two-sentence message with natural punctuation and no marketing formatting (no all-caps, no URL, no phone numbers, no discount codes).
3. Contextual interpretation: Reads like a personal check-in or quick question between acquaintances about buying activity, not an unsolicited advertisement or scam.
4. Decision summary: The message is a brief, informal inquiry without promotional content, so it is classified as ham."
3617,ham,Can you plz tell me the ans. BSLVYL sent via fullonsms.com,spam,ham,True,3,"['gpt-3.5-turbo-0125', 'gpt-5-nano', 'gpt-4o-mini']","1. Linguistic cues: The message uses a polite request (""Can you plz tell me the ans.""), shorthand (""plz"", ""ans.""), and refers to a specific code (""BSLVYL""), indicating a personal question rather than marketing language.
2. Structural cues: Short, conversational SMS style with informal abbreviations and a single informational URL mention (""fullonsms.com""); there are no promotional phrases, calls-to-action, prices, or urgency markers.
3. Contextual interpretation: The sender is asking for help identifying or decoding a message/code that was sent via an SMS service; the intent appears to be informational or personal assistance, not to advertise or solicit.
4. Decision summary: The content is a personal request for information and lacks promotional or fraudulent indicators, so it is classified as ham."
3650,ham,"Gumby's has a special where a <#> "" cheese pizza is $2 so I know what we're doin tonight",spam,ham,True,3,"['gpt-4.1-mini', 'gpt-3.5-turbo-0125', 'gpt-4o-mini']","1. Linguistic cues: Casual, conversational language (""I know what we're doin tonight""), first-person reference, and slang-like contraction indicating a personal message rather than a formal advertisement.
2. Structural cues: Informal punctuation and spacing, inclusion of a placeholder ""<#>"" suggesting a conversational mention of pizza size, not polished marketing copy.
3. Contextual interpretation: The sender is informing/arranging plans with the recipient about a cheap pizza special—not soliciting or promoting to a broad audience.
4. Decision summary: The message reads like a personal plan based on a local deal, so it is legitimate personal communication (ham)."
3945,spam,Missed call alert. These numbers called but left no message. 07008009200,ham,ham,False,3,"['gpt-5-nano', 'gpt-5-mini', 'gpt-4.1']","1. Linguistic cues: The message uses neutral, informational language (""Missed call alert"", ""called but left no message"") without persuasive, promotional, or urgent phrases typical of spam (e.g., ""win"", ""free"", ""act now"").
2. Structural cues: Short, factual structure with a single phone number listed; lacks links, offers, strange punctuation or call-to-action that often indicate spam or phishing.
3. Contextual interpretation: The intent appears to be a simple notification about missed calls, a common legitimate service provided by telecom operators or call-tracking services.
4. Decision summary: The message is an informational alert rather than a promotional or fraudulent solicitation, so it is classified as ham."
3976,spam,"accordingly. I repeat, just text the word ok on your mobile phone and send",ham,spam,True,3,"['gpt-3.5-turbo-0125', 'gpt-5', 'gpt-4.1']","1. Linguistic cues: Imperative phrasing (""just text the word ok"", ""I repeat"") and short directive language are common in automated or promotional prompts rather than natural personal conversation.
2. Structural cues: Lack of personal address or context, clipped sentence fragments, and repetitive instruction suggest a generic mass message or automated request.
3. Contextual interpretation: The message seeks an immediate reply with a single keyword—behavior often used by marketers or scammers to confirm active numbers or opt users into services.
4. Decision summary: The combination of a generic imperative request, repetition, and absence of personal context indicates an unsolicited, likely promotional/automated intent, so it is classified as spam."
4021,spam,thesmszone.com lets you send free anonymous and masked messages..im sending this message from there..do you see the potential for abuse???,ham,ham,False,3,"['gpt-5', 'gpt-5-mini', 'gpt-4.1']","1. Linguistic cues: The message uses conversational language (""im sending this message from there..do you see the potential for abuse???"") and asks a rhetorical/questioning prompt rather than making an unsolicited offer or call to action. Although it mentions ""free,"" the tone is informational/concerned rather than promotional.
2. Structural cues: Informal punctuation (ellipses, multiple question marks) and first-person statement indicate a personal or demonstrative message, not the polished formatting typical of marketing or phishing.
3. Contextual interpretation: The sender appears to be demonstrating a capability of a service and soliciting an opinion about possible misuse, suggesting discussion or warning rather than an attempt to sell, solicit, or defraud.
4. Decision summary: Overall the content is informational and conversational with no promotional, fraudulent, or unsolicited intent, so it is classified as ham."
4150,ham,i want to grasp your pretty booty :),spam,ham,True,3,"['gpt-3.5-turbo-0125', 'gpt-5-mini', 'gpt-4o-mini']","1. Linguistic cues: uses direct first-person desire (""i want to grasp your pretty booty""), explicit sexual language (""booty""), and a friendly emoticon ("":)""), indicating a personal/sexual tone rather than commercial phrasing.
2. Structural cues: short, informal, lowercase texting style with no links, offers, prices, or call-to-action typical of promotional or scam messages.
3. Contextual interpretation: content appears to be a private sexual solicitation or flirtation directed at an individual rather than an unsolicited advertisement, fraud, or mass-distributed promotion.
4. Decision summary: although explicit and potentially inappropriate, the message is personal/sexual in nature and lacks hallmarks of spam (commercial content, links, or scam indicators), so it is classified as ham."
4312,ham,Good. do you think you could send me some pix? I would love to see your top and bottom...,spam,spam,False,3,"['gpt-3.5-turbo-0125', 'gpt-5-mini', 'gpt-4o-mini']","1. Linguistic cues: Uses requests for ""pix"" and explicit phrasing (""your top and bottom""), sexual solicitation language indicating an attempt to obtain intimate images.
2. Structural cues: Short, direct imperative/question format asking for content, informal shorthand (""pix""), and trailing ellipsis implying persistence or suggestiveness.
3. Contextual interpretation: The intent is to solicit explicit photos—unsolicited sexual content—which fits patterns of spam/unwanted solicitation even if not commercial.
4. Decision summary: The message is an unsolicited sexual request for images (solicitation), so it should be classified as spam."
4441,ham,Prepare to be pleasured :),spam,ham,True,3,"['gpt-3.5-turbo-0125', 'gpt-4o-mini', 'gpt-4.1']","1. Linguistic cues: The phrase ""Prepare to be pleasured"" is direct, intimate and sexual; the smiling emoticon "":)"" reinforces a personal, flirtatious tone rather than promotional language.
2. Structural cues: Very short, informal message with no links, offers, discounts, phone numbers, or call-to-action typical of spam.
3. Contextual interpretation: The intent appears to be personal/romantic or sexual communication aimed at an individual, not an attempt to sell, solicit, or defraud a broad audience.
4. Decision summary: The wording and format indicate a personal, flirtatious message rather than unsolicited advertising or fraud, so it is classified as ham."
4528,ham,yes baby! I need to stretch open your pussy!,spam,ham,True,3,"['gpt-4.1-mini', 'gpt-3.5-turbo-0125', 'gpt-4o-mini']","1. Linguistic cues: Uses intimate terms (""baby"") and explicit sexual language (""pussy"", ""stretch open"") indicating a personal, erotic message.
2. Structural cues: Informal, direct address with exclamation; no promotional language, links, offers, or call-to-action typical of spam.
3. Contextual interpretation: Reads as a personal sexual proposition between individuals rather than an unsolicited advertisement, fraud, or mass-marketing message.
4. Decision summary: The message is explicit and sexual but clearly personal and not promotional or fraudulent, so it should be labeled ham."
4594,ham,Hey do you want anything to buy:),spam,ham,True,3,"['gpt-3.5-turbo-0125', 'gpt-5-nano', 'gpt-4o-mini']","1. Linguistic cues: Uses casual greeting ""Hey"", direct second-person ""you"", and a friendly emoticon "":)"", indicating a personal, conversational tone rather than promotional language.
2. Structural cues: Short, informal sentence with no links, offers, discounts, or salesy phrases; punctuation and smiley suggest a personal message.
3. Contextual interpretation: Reads like someone offering to buy something for the recipient (a personal favor), not an unsolicited advertisement or scam.
4. Decision summary: The friendly, direct language and lack of promotional elements indicate a personal message, so it is classified as ham."
4995,ham,I will be gentle baby! Soon you will be taking all <#> inches deep inside your tight pussy...,spam,spam,False,3,"['gpt-4.1-mini', 'gpt-3.5-turbo-0125', 'gpt-4o-mini']","1. Linguistic cues: Explicit sexual language (""tight pussy"", ""inches deep"") and a direct sexual promise (""I will be gentle baby"") indicate sexual solicitation rather than a neutral personal message.
2. Structural cues: Use of a nickname (""baby""), exclamation, and a numeric placeholder (""<#> inches"") resemble templated or mass-sent erotic/solicitous messages.
3. Contextual interpretation: The message's purpose appears to be sexual arousal/solicitation rather than carrying personal, informational, or transactional content; such unsolicited erotic content is typically classified as spam.
4. Decision summary: Explicit, solicitation-style language and template-like structure point to unsolicited sexual spam rather than legitimate personal communication."
